,title,rating,metascore,publisher,review
468,Apocalypse Now,8.4,100,New Times (L.A.)," Coppola and Murch have balanced their new edit with grace notes of sweetness, elegance and eroticism, and the payoff is grand, providing both a reprieve from the multiple blitzkriegs and a break in the monotony of the cruise up the Nung. "
469,Apocalypse Now,8.4,100,Mr. Showbiz, No other movie released this year is as much of a filmgoing necessity as Francis Ford Coppola's Apocalypse Now Redux. 
470,Apocalypse Now,8.4,100,Time Out London," As befits both its tortuous hand-to-mouth genesis and the devastating conflict it reflects, this is a film of pure sensation, dazzling audiences with light and noise, laying bare the stark horror – and unimaginable thrill – of combat. And therein lies the true heart of darkness: if war is hell and heaven intertwined, where does morality fit in? And, in the final apocalyptic analysis, will any of it matter? "
471,Apocalypse Now,8.4,100,Total Film, Francis Ford Coppola went into the jungle to make his surreal ’Nam epic and almost lost his mind during one of the most protracted and accident-prone shoots in history. Thankfully the hallucinogenic results justified the means. 
472,Apocalypse Now,8.4,100,The Guardian, A film that needs to be seen on the big screen. 
473,Apocalypse Now,8.4,100,Empire," Flawed but staggering cinema, the unforgettable Apocalypse Now setpieces are extraordinary. "
474,Apocalypse Now,8.4,88,New York Daily News," Coppola, with his bravura style of direction, has created a movie of harrowing intensity and staggering power. But if you accept the belief that art should enlighten and illuminate as well as arouse the emotions, I’m afraid that Apocalypse Now does not qualify as great art. "
475,Apocalypse Now,8.4,40,Washington Post," The finished film remains a mess of tangled, turgid continuity and florid, mock-operatic style -- at best a collection of production numbers and set pieces waiting in rain for a story capable of accumulating suspense and meaning. "
476,Memento,8.4,91,Portland Oregonian, A hard and bright and tough film in all the best ways. 
477,Memento,8.4,90,TV Guide Magazine, Enthralling or infuriating. 
478,Memento,8.4,88,Chicago Tribune, A puzzle movie in which the puzzle is actually worth the time and effort to solve. 
479,Memento,8.4,88,Philadelphia Inquirer, Terrifically satisfying film. 
480,Memento,8.4,80,L.A. Weekly," If nothing else, Memento is a savvy comment on the queasy uncertainties of the postmodern condition, in which history goes no further back than yesterday's news, and knowledge is supplanted by ""information"" from a tumult of spin-controlled, unreliable narrators. "
481,Memento,8.4,75,Miami Herald, Fiendishly tricky contraption. 
482,Memento,8.4,75,San Francisco Chronicle," Bound to be talked about, debated and eviscerated far more than it's understood. "
483,Memento,8.4,70,Time," The film takes this attempt to shatter narrative into little pieces about as far into incoherence as it can go; yet it is also full of odd, hypnotic menace. "
484,Memento,8.4,50,Dallas Observer, Feels mostly like an audacious prank. 
485,Memento,8.4,40,Austin Chronicle," Once you've seen it all once I bet you'll wish you were watching ""Groundhog Day"" -- again. "
486,Alien,8.4,100,Dallas Observer," This is the breakout role for Sigourney (née Susan) Weaver, whose iconic presence still propels this ride beyond the scores of substandard imitations that followed. Why see it on the big screen? Because it's bloody brilliant. "
487,Alien,8.4,100,San Francisco Chronicle, Feels like a streamlined improvement on the original. 
488,Alien,8.4,90,The A.V. Club," Despite years of imitators, sequels (some great, some not so), and edited-for-television broadcasts, Alien has lost none of its power, and the big screen only intensifies its impact. "
489,Alien,8.4,90,Los Angeles Times," Twenty-four years later -- digitally spruced up, with some scenes shaved and others padded with previously cut material -- Scott's film still shreds nerves. "
490,Alien,8.4,88,ReelViews," The most important features of this ""new"" version are the digital cleaning of the print and the re-mastering of the sound. There are a few added scenes, but they are mostly insignificant and have been previously seen (at least by fans of the movie) on the laserdisc or DVD releases. "
491,Alien,8.4,88,Baltimore Sun," Alien, even with some scene tinkering that has left this ""director's cut"" one minute shorter than its original release, is still one of the creepiest, scariest, most shocking films ever. "
492,Alien,8.4,88,Boston Globe," What's most unusual about the original 24 years later, though, is its elegant minimalism. "
493,Alien,8.4,88,Chicago Tribune," An old nightmare, made shiny new. "
494,Alien,8.4,88,New York Post," Mostly it's worth seeing Alien, which established Scott as an A-list director, in a theater because his brilliant and often expansive visuals have always worked better on a big screen than on video. "
495,Alien,8.4,30,Chicago Reader," An empty-headed horror movie (1979) with nothing to recommend it beyond the disco-inspired art direction and some handsome, if gimmicky, cinematography. "
496,Nuovo Cinema Paradiso,8.4,100,Time," Remain open to fantasies but not be consumed by them. These are good lessons for a would-be director. They are good lessons for everybody. And no recent movie has taught them with more patient sweetness. [Feb. 5, 1990] "
497,Nuovo Cinema Paradiso,8.4,100,The Globe and Mail (Toronto), Cinema Paradiso converts you to the credo that art can indeed be holy. 
498,Nuovo Cinema Paradiso,8.4,100,San Francisco Chronicle," You leave Cinema Paradiso with that feeling that's kind of like getting kicked in the stomach, but nice. It's one of those breathless, swept-away-by-a-movie experiences that you might have once a year, if you're lucky. [16 February 1990, Daily Notebook, p.E-1] "
499,Nuovo Cinema Paradiso,8.4,88,Chicago Sun-Times, Anyone who loves movies is likely to love Cinema Paradiso. 
500,Nuovo Cinema Paradiso,8.4,80,Washington Post, Just about everything you ever loved (or hated) about Italian films can be found. 
501,Nuovo Cinema Paradiso,8.4,75,USA Today," Lovely “memory'' film. [2 March 1990, Life, p.4D] "
502,Nuovo Cinema Paradiso,8.4,70,Film.com," A sweet, funny exercise in nostalgia, though it's also self-congratulatory and awfully calculating. "
503,Nuovo Cinema Paradiso,8.4,50,Chicago Reader," Originally a two-part film running about three hours, this treacle has been reduced by almost a third, though it still seems to run on forever -- a bit like life but much less interesting. "
504,Nuovo Cinema Paradiso,8.4,50,TV Guide Magazine," They don't make movies like they used to, and this Oscar-winning Italian-French co-production spends the better part of three hours proving it. "
505,Nuovo Cinema Paradiso,8.4,50,Chicago Tribune," A few moments of sly inspiration are not enough to carry an entire feature; along with the tears, it leaves behind an aftertaste of phoniness. [16 March 1990, Friday, p.H] "
506,Spider-Man: Into the Spider-Verse,8.4,92,TheWrap," It’s incredibly thrilling to watch, impressively emotional throughout, and easily the best Spider-Man movie since “Spider-Man 2.” "
507,Spider-Man: Into the Spider-Verse,8.4,90,IGN, Spider-Man: Into the Spider-Verse delivers a dynamic visual experience unlike any other. 
508,Spider-Man: Into the Spider-Verse,8.4,88,USA Today," It’s a slightly insane, hilariously daring and often touching mashup of everything that makes super-flicks so darn popular with the introduction of a Spider-Man who's ready-made for today’s generation of kids. "
509,Spider-Man: Into the Spider-Verse,8.4,83,IndieWire," Tragic news for anyone who’s sick of superhero movies: Spider-Man: Into the Spider-Verse completely reinvigorates the genre, reaffirms why it’s resonating with a diverse modern audience that’s desperate to fight the power, and reiterates to us how these hyper-popular spandex myths are able to reinvent themselves on the fly whenever things get stale. "
510,Spider-Man: Into the Spider-Verse,8.4,83,The A.V. Club," The filmmaking itself is often witty, finding gags in whip-crack editing and shifts in perspective. "
511,Spider-Man: Into the Spider-Verse,8.4,80,ScreenCrush," Into the Spider-Verse really is the ultimate Spider-Man film in a lot of ways, the one that crystallizes the character’s moral philosophy, his life lessons, his arachnid athleticism, and his quirky sense of humor into one hugely appealing package. It’s pure dorky fun. "
512,Spider-Man: Into the Spider-Verse,8.4,80,Vox," With its risky visual storytelling and tender script, Into the Spider-Verse earns the greatest honor that one can bestow on a Spider-Man movie: It somehow makes you want to see more Spider-Man movies. Including at least a few more for Miles Morales alone. "
513,Spider-Man: Into the Spider-Verse,8.4,80,Screen International," A confident blend of comic-book élan and stirring sentiment, Spider-Man: Into The Spider-Verse finds fresh ways to tell the familiar story of everyone’s favourite web-slinger. "
514,Spider-Man: Into the Spider-Verse,8.4,70,The Hollywood Reporter," The freshest and most stimulating aspect of the film is the visual style, which unites the expected Marvel mix of “universes” (it used to be assumed there was only one universe in creation) with animation that looks both computer-driven and hand-drawn, boasts futuristic as well as funky urban elements, moves the “camera” a lot and brings together a melting pot of mostly amusing new characters. "
515,Spider-Man: Into the Spider-Verse,8.4,67,Entertainment Weekly," For a film that invites so much self-aware chortling over franchise in-jokery, you feel Spider-Verse has missed something essential from its own screen history. "
516,The Lives of Others,8.4,100,The New Yorker," If there is any justice, this year's Academy Award for best foreign-language film will go to The Lives of Others, a movie about a world in which there is no justice. "
517,The Lives of Others,8.4,90,Los Angeles Times," It convincingly demonstrates that when done right, moral and political quandaries can be the most intensely dramatic dilemmas of all. "
518,The Lives of Others,8.4,90,Newsweek," It's hard to believe this is von Donnersmarck's first feature. His storytelling gifts have the novelistic richness of a seasoned master. The accelerating plot twists are more than just clever surprises; they reverberate with deep and painful ironies, creating both suspense and an emotional impact all the more powerful because it creeps up so quietly. "
519,The Lives of Others,8.4,90,New York Magazine (Vulture)," Ulrich Mühe gives a marvelously self-contained performance. There isn't an ounce of fat on his body, or in his acting: He has pared himself down to a pair of eyes that prowl the faces of his character's countrymen for signs of arrogance--i.e., of independent thinking. "
520,The Lives of Others,8.4,88,Rolling Stone, Von Donnersmarck has crafted the best kind of movie: one you can't get out of your head. 
521,The Lives of Others,8.4,88,ReelViews," With solid performances and a terrific screenplay, this movie offers solid, no-frills drama that feels organic and believable, not contrived. "
522,The Lives of Others,8.4,80,The Hollywood Reporter, Starts out dark and challenging then comes to a startlingly satisfying and warmly human conclusion that lingers long after the curtain has come down. 
523,The Lives of Others,8.4,80,Variety, Superbly cast drama… that looks to be a solid upscale attraction wherever the special chemistry of good writing and performances is appreciated. 
524,The Lives of Others,8.4,70,Village Voice, A compelling thriller but an unsatisfying character drama. 
525,The Lives of Others,8.4,50,L.A. Weekly," The Lives of Others wants us to see that the Stasi -- at least some of them -- were, like their Gestapo brethren, “just following orders."" You can call that naive optimism on Donnersmarck's part, or historical revisionism of the sort duly lambasted by the current film version of Alan Bennett's ""The History Boys."" I, for one, tremble at the thought of what this young director does for an encore. "
526,Dr. Strangelove or: How I Learned to Stop Worrying and Love the Bomb,8.4,100,ReelViews, A masterpiece... The genius of Dr. Strangelove is that it's possible to laugh -- and laugh hard -- while still recognizing the intelligence and insight behind the humor. 
527,Dr. Strangelove or: How I Learned to Stop Worrying and Love the Bomb,8.4,100,TV Guide Magazine, The film is a model of barely controlled hysteria in which the absurdity of hypermasculine Cold War posturing becomes devastatingly funny--and at the same time nightmarishly frightening in its accuracy. 
528,Dr. Strangelove or: How I Learned to Stop Worrying and Love the Bomb,8.4,100,Austin Chronicle," More lethal than a nuclear waste dump, Kubrick's komedy at least kills us with laughter... It's one of the greatest - and undoubtably the most hilarious - antiwar statements ever put to film. "
529,Dr. Strangelove or: How I Learned to Stop Worrying and Love the Bomb,8.4,100,Chicago Sun-Times," Seen after 30 years, Dr. Strangelove seems remarkably fresh and undated - a clear-eyed, irreverant, dangerous satire. And its willingness to follow the situation to its logical conclusion - nuclear annihilation - has a purity that today's lily-livered happy-ending technicians would probably find a way around. "
530,Dr. Strangelove or: How I Learned to Stop Worrying and Love the Bomb,8.4,100,Dallas Observer, Kubrick's comic gem sparkles with enduring relevance. 
531,Dr. Strangelove or: How I Learned to Stop Worrying and Love the Bomb,8.4,100,Village Voice," The hard-charging originality of the screenplay—the equivalent of turning ""The Hot Zone"" into a Farrelly comedy—suggests a deficient legacy of credit to Terry Southern's corner. "
532,Dr. Strangelove or: How I Learned to Stop Worrying and Love the Bomb,8.4,100,Boston Globe," Is Dr. Strangelove Kubrick's best movie? Along with ''Paths of Glory,"" absolutely. "
533,Dr. Strangelove or: How I Learned to Stop Worrying and Love the Bomb,8.4,90,Variety," George C. Scott as the fiery Pentagon general who seizes on the crisis as a means to argue for total annihilation of Russia offers a top performance, one of the best in the film. Odd as it may seem in this backdrop, he displays a fine comedy touch. "
534,Dr. Strangelove or: How I Learned to Stop Worrying and Love the Bomb,8.4,80,Chicago Reader," Yet some of the laughs come too easy and linger too long; for the film's message to have maximum impact, the laughter has to stick in your throat. "
535,Dr. Strangelove or: How I Learned to Stop Worrying and Love the Bomb,8.4,70,The New York Times," The ultimate touch of ghoulish humor is when we see the bomb actually going off, dropped on some point in Russia, and a jazzy sound track comes in with a cheerful melodic rendition of ""We'll Meet Again Some Sunny Day."" Somehow, to me, it isn't funny. It is malefic and sick. "
536,Avengers: Infinity War,8.4,90,IGN," Using the strength of its powerful and interesting villain to set the stakes higher than ever, Avengers: Infinity War successfully brings together the past 10 years of Marvel movies into a largely effective cocktail of super-heroic dramatics. "
537,Avengers: Infinity War,8.4,80,The Guardian," Somehow in its pure uproariousness, it works. It’s just a supremely watchable film, utterly confident in its self-created malleable mythology. And confident also in the note of apocalyptic darkness. "
538,Avengers: Infinity War,8.4,80,New York Daily News," The script is surprisingly smart, pulling together all the subplots and cutting among all the locations. Chris Pratt’s Star Lord has some clever lines. Thanos is a far more complex villain than we usually get. And the movie ends on a stark and shocking note. "
539,Avengers: Infinity War,8.4,75,Rolling Stone," Avengers: Infinity War leaves viewers up in the air, feeling exhilarated and cheated at the same time, aching for a closure that never comes ... at least not yet. "
540,Avengers: Infinity War,8.4,75,IndieWire," As a virtuoso juggling act, Infinity War has no real parallel in popular culture; as a movie, it’s an impressive montage of greatest hits until the gut punch of a finale. "
541,Avengers: Infinity War,8.4,75,Entertainment Weekly, What saves Infinity War from being just another bloated supergroup tour – and what will end up being the thing that blows fans’ minds to dust – is the film’s final stretch. 
542,Avengers: Infinity War,8.4,70,TheWrap," Directors Joe and Anthony Russo move their many playing pieces around with as much grace as possible, and they offer up jolts of pleasure throughout. "
543,Avengers: Infinity War,8.4,70,We Got This Covered," Avengers: Infinity War cares a bit too much about being ""Part 1"" and holding enough development for ""Part 2,"" but MCU fans should see their 10-year buildup expectations met - not exceeded, but met. "
544,Avengers: Infinity War,8.4,60,ScreenCrush," I appreciate the sheer logistical achievement of Infinity War (and the chutzpah of its ending). I laughed a bunch of times, and some of the scenes are definitely exciting. But I would be lying if I pretended this movie ever grabbed me the way the best MCU movies did. "
545,Avengers: Infinity War,8.4,50,Slant Magazine, Infinity War is all manic monotony. It's passably numbing in the moment. And despite the hard-luck finish—something an obligatory post-credits sequence goes a long way toward neutering—it's instantly forgettable. 
546,Django Unchained,8.4,100,Boxoffice Magazine," A sharp shock of a film in an Awards season very full of movies so noble they become immobile. It's wildly unlikely to get much love from the Academy, and that's fine-bluntly, it's too good for them. With its bloody stew of history and hysteria, action taken from movies and atrocities taken from fact, Django isn't just a movie only America could make-it's also a movie only America needs to. "
547,Django Unchained,8.4,100,Variety, An immensely satisfying taste of antebellum empowerment packaged as spaghetti-Western homage... A bloody hilarious (and hilariously bloody) Christmas counter-programmer. 
548,Django Unchained,8.4,100,The Guardian," Django Unchained also has the pure, almost meaningless excitement which I found sorely lacking in Tarantino's previous film, Inglourious Basterds, with its misfiring spaghetti-Nazi trope and boring plot. I can only say Django delivers, wholesale, that particular narcotic and delirious pleasure that Tarantino still knows how to confect in the cinema, something to do with the manipulation of surfaces. It's as unwholesome, deplorable and delicious as a forbidden cigarette. "
549,Django Unchained,8.4,80,The Hollywood Reporter," Only Tarantino could come up with such a wild cross-cultural mash, a smorgasbord of ingredients stemming from spaghetti Westerns, German legend, historical slavery, modern rap music, proto-Ku Klux Klan fashion, an assembly of '60s and '70s character actors and a leading couple meant to be the distant forebears of blaxploitation hero John Shaft and make it not only digestible but actually pretty delicious. "
550,Django Unchained,8.4,80,Time Out," Vibrating with the geekery of a filmmaker off the chain, the movie plays like no other this year. Tarantino, steeped in even the smallest Leonean gesture (what's with the weird terrain shifts?), knows how to satisfy fans of scuzzy Italian horse operas and badass superviolence in equal measure. "
551,Django Unchained,8.4,75,IndieWire," At times more in line with ""Blazing Saddles"" than the grimly bawdy qualities that define many bonafide oaters, Django Unchained erupts with a conceptual brilliance from the outset that never fully meshes with its clumsy storyline. Nevertheless, it's a giddy ride. "
552,Django Unchained,8.4,67,Entertainment Weekly," DiCaprio, having a blast, makes Candie the equivalent of Waltz's Nazi in ""Inglourious Basterds"": a racist villain who mesmerizes us by elevating his ideology into a puckishly thought-out vision of the world. Yet Django isn't nearly the film that Inglourious was. "
553,Django Unchained,8.4,63,Slant Magazine," While the rush toward a conventional climax is confusing, and more than a little disappointing, there's an undeniable pleasure that emerges in seeing Tarantino juggle the dynamite of his ideas, even when they prematurely pop off in his face. "
554,Django Unchained,8.4,60,Movieline," The film also comes across like a rough cut that was never looked at as a coherent whole, and some segments that start off as promising become interminable while others feel entirely unnecessary. There's no pressure on or expectation for Tarantino to please anyone other than himself, and the film feels overstuffed with ideas that should have been pruned. "
555,Django Unchained,8.4,42,The Playlist," It's not particularly funny or moving and it's terribly self-indulgent. Flamboyance and cartoonishness rule, there's hardly a moment of genuine emotion, and most overtures in that direction are superficial. As a picture ostensibly about love, revenge and the ugliness of slavery, Django Unchained has almost zero subtext and is a largely soulless bloodbath, in which the history of pain and retribution is coupled carelessly with a cool soundtrack and some verbose dialogue. Though it might just entertain the sh.t out of the less discerning. "
556,The Shining,8.4,100,Chicago Sun-Times," But there is no way, within the film, to be sure with any confidence exactly what happens, or precisely how, or really why. Kubrick delivers this uncertainty in a film where the actors themselves vibrate with unease. "
557,The Shining,8.4,100,Empire," Ostensibly a haunted house story, it manages to traverse a complex world of incipient madness, spectral murder and supernatural visions ...and also makes you jump. "
558,The Shining,8.4,80,The New York Times," Meticulously detailed and never less than fascinating, The Shining may be the first movie that ever made its audience jump with a title that simply says ""Tuesday."" "
559,The Shining,8.4,80,Film Threat," For a supposed mainstream movie, Kubrick’s The Shining isn’t very audience friendly. Half the time you have to guess what the hell is going on, and if you're not familiar with Kubrick's narrative style you’ll be completely lost. "
560,The Shining,8.4,75,Boston Globe," When you sit down to The Shining, you sit down with normal expectations of being diverted, perhaps even being gripped, but not being undermined. But the film undermines you in powerful, inchoate ways. It's a horror story even for people who don't like horror stories - maybe especially for them. [14 Jun 1980, p.1] "
561,The Shining,8.4,70,Salon," Stephen King reportedly loathed the liberties Kubrick and co-writer Diane Johnson took with his story, but King's ur-villain, the emasculated husband from hell, has never been more clearly presented on-screen. "
562,The Shining,8.4,50,Time," It is a daring thing the director has done, this bleaching out of all the cheap thrills, this dashing of all the hopes one brings to what is, after all, advertised as ""a masterpiece of modern horror."" Certainly he has asked much of Nicholson, who must sustain attention in a hugely unsympathetic role, and who responds with a brilliantly crazed performance. "
563,The Shining,8.4,40,Variety," The crazier Nicholson gets, the more idiotic he looks. Shelley Duvall transforms the warm sympathetic wife of the book into a simpering, semi-retarded hysteric. "
564,The Shining,8.4,40,Chicago Reader," Kubrick is after a cool, sunlit vision of hell, born in the bosom of the nuclear family, but his imagery--with its compulsive symmetry and brightness--is too banal to sustain interest, while the incredibly slack narrative line forestalls suspense. "
565,The Shining,8.4,38,The Globe and Mail (Toronto)," Kubrick certainly doesn't fail small. One could fast forget The Shining as an overreaching, multi-levelled botch were it not for Jack Nicholson. Nicholson, one of the few actors capable of getting the audience to love him no matter what he does, is an ideal vehicle for Kubrick. [14 Jun 1980, p.E1] "
566,WALL·E,8.4,100,Village Voice, A film that's both breathtakingly majestic and heartbreakingly intimate. 
567,WALL·E,8.4,100,The Hollywood Reporter," The visual design of Wall-E is arguably Pixar's best. Stanton, who wrote the script with Jim Reardon from a story he concocted with Peter Docter, creates two fantastically imaginative, breathtakingly lit worlds. "
568,WALL·E,8.4,100,Chicago Tribune," While I may argue with the little guy's taste in musicals, it's remarkable to see any film, in any genre, blend honest sentiment with genuine wit and a visual landscape unlike any other. "
569,WALL·E,8.4,100,New York Post," A charming, hilarious robot love story aimed at the entire family. "
570,WALL·E,8.4,100,USA Today," At once futuristic, funny and fantastical. "
571,WALL·E,8.4,89,Austin Chronicle," This is Pixar's finest and most emotionally powerful film yet, and it draws on a wealth of cinematic resources that run the gamut from Chaplin's best to Buster Keaton, Jacques Tati, and even Martin and Lewis. "
572,WALL·E,8.4,88,Chicago Sun-Times," Succeeds at being three things at once: an enthralling animated film, a visual wonderment and a decent science-fiction story. "
573,WALL·E,8.4,88,Charlotte Observer, A potent environmental message wrapped up in an irresistibly cute romance between robots. 
574,WALL·E,8.4,80,Variety," Walks a fine line between the rarefied and the immediately accessible as it explores new territory for animation, yet remains sufficiently crowd-pleasing. "
